{
  "recipeVersion": 1,
  "revision": 1,
  "id": "meteor_shower_ultimate_3d",
  "name": "Meteor Shower Ultimate 3d",
  "dimension": "3d",
  "archetype": "composite",
  "style": {
    "token": "stylized",
    "palette": {
      "primary": "#D8491E",
      "secondary": "#FF9E31",
      "accent": "#F2D0A2"
    },
    "outline": 0.1,
    "shading_steps": 4,
    "noise_scale": 1.2,
    "glow_strength": 1.05
  },
  "targetProfile": "mobile_medium",
  "randomSeed": 3496743088,
  "stages": [
    {
      "id": "main",
      "trigger": "manual",
      "duration": 5.0,
      "enabled": true,
      "modules": [
        {
          "id": "body",
          "kind": "energy_body",
          "templateId": "PFT_3D_FireCore",
          "parameters": {
            "scale": 1.0
          },
          "enabled": true
        }
      ]
    }
  ],
  "metadata": {
    "createdBy": "w13-w18-composite",
    "templateCatalogVersion": "1.0.0"
  },
  "timeline": [
    {
      "t": 0.0,
      "ref_id": "warning_telegraph_3d",
      "action": "play",
      "overrides": {
        "scale": 1.0,
        "palette": "ultimate"
      }
    },
    {
      "t": 0.9,
      "ref_id": "warning_telegraph_3d",
      "action": "stop"
    },
    {
      "t": 1.0,
      "ref_id": "meteor_impact_3d",
      "action": "play",
      "overrides": {
        "scale": 1.0,
        "position": [
          -1.5,
          0.7,
          0.0
        ],
        "palette": "ultimate"
      }
    },
    {
      "t": 1.5,
      "ref_id": "meteor_impact_3d",
      "action": "play",
      "overrides": {
        "scale": 0.9,
        "position": [
          0.9,
          0.3,
          0.0
        ],
        "palette": "ultimate"
      }
    },
    {
      "t": 2.0,
      "ref_id": "meteor_impact_3d",
      "action": "play",
      "overrides": {
        "scale": 1.2,
        "position": [
          -0.4,
          -0.3,
          0.0
        ],
        "palette": "ultimate"
      }
    },
    {
      "t": 2.5,
      "ref_id": "meteor_impact_3d",
      "action": "play",
      "overrides": {
        "scale": 0.85,
        "position": [
          1.5,
          -0.5,
          0.0
        ],
        "palette": "ultimate"
      }
    },
    {
      "t": 3.0,
      "ref_id": "meteor_impact_3d",
      "action": "play",
      "overrides": {
        "scale": 1.15,
        "position": [
          0.2,
          0.6,
          0.0
        ],
        "palette": "ultimate"
      }
    },
    {
      "t": 3.5,
      "ref_id": "meteor_impact_3d",
      "action": "play",
      "overrides": {
        "scale": 1.0,
        "position": [
          -1.0,
          -0.8,
          0.0
        ],
        "palette": "ultimate"
      }
    },
    {
      "t": 4.6,
      "ref_id": "smoke_plume_area_3d",
      "action": "play",
      "overrides": {
        "scale": 1.35,
        "palette": "ultimate"
      }
    }
  ],
  "camera_hints": [
    {
      "t": 0.9,
      "type": "zoom",
      "strength": 0.3
    },
    {
      "t": 2.0,
      "type": "shake",
      "strength": 0.7
    },
    {
      "t": 3.5,
      "type": "shake",
      "strength": 0.9
    }
  ],
  "gates": []
}