{"recipeVersion":1,"revision":1,"id":"cap_telegraph_impact_3d","name":"Capability Blank - Telegraph Impact","dimension":"3d","archetype":"impact","style":{"token":"stylized","palette":{"primary":"#8FA3B8","secondary":"#DDE6F0","accent":"#FFFFFF"}},"targetProfile":"mobile_medium","randomSeed":301,"behavior":{"hit":{"type":"single"},"emission":{"type":"single"},"timing":{"type":"telegraph","warn_duration":0.8,"shape":"circle","fill_style":"center_fill","impact_slot":"cap_hexflash_impact_2d"}},"stages":[{"id":"timing","trigger":"on_launch","duration":1.2,"enabled":true,"modules":[{"id":"marker","kind":"energy_body","templateId":"PFT_3D_FireCore","parameters":{"scale":0.6},"enabled":true}]}],"metadata":{"createdBy":"capability-blank","templateCatalogVersion":"1.0.0"}}
