{
  "recipeVersion": 1,
  "revision": 1,
  "id": "spore_burst_impact_2d",
  "name": "Spore Burst Impact 2d",
  "dimension": "2d",
  "archetype": "impact",
  "style": {
    "token": "stylized",
    "palette": {
      "primary": "#8CD62E",
      "secondary": "#4E7A1E",
      "accent": "#D9FF84"
    },
    "outline": 0.12,
    "shading_steps": 4,
    "noise_scale": 1.1,
    "glow_strength": 1.25
  },
  "behavior": {
    "hit": {
      "type": "single"
    },
    "emission": {
      "type": "single"
    },
    "timing": {
      "type": "instant"
    }
  },
  "content": {
    "family": "toxic",
    "parameters": {
      "cloud_radius": 2.4,
      "linger_time": 1.2,
      "spore_count": 32
    }
  },
  "targetProfile": "mobile_medium",
  "randomSeed": 1870817157,
  "stages": [
    {
      "id": "main",
      "trigger": "on_hit",
      "duration": 1.2000000476837158,
      "enabled": true,
      "modules": [
        {
          "id": "body",
          "kind": "energy_body",
          "templateId": "PFT_2D_FireCore",
          "parameters": {
            "scale": 1.0
          },
          "enabled": true
        },
        {
          "id": "flow",
          "kind": "motion_trail",
          "templateId": "PFT_2D_FireTrail",
          "parameters": {
            "time": 0.28,
            "width": 0.25
          },
          "attachTo": "body",
          "enabled": true
        },
        {
          "id": "secondary",
          "kind": "secondary_particles",
          "templateId": "PFT_2D_Embers",
          "parameters": {
            "rate": 12,
            "lifetime": 0.55
          },
          "attachTo": "body",
          "enabled": true
        },
        {
          "id": "accent",
          "kind": "shockwave",
          "templateId": "PFT_2D_Shockwave",
          "parameters": {
            "lifetime": 0.3,
            "endSize": 2.4
          },
          "enabled": true
        }
      ]
    }
  ],
  "metadata": {
    "createdBy": "w3-w8-element-family",
    "templateCatalogVersion": "1.0.0"
  }
}