{"recipeVersion":1,"revision":1,"id":"b_boulder","name":"Heavy Boulder","dimension":"2d","archetype":"projectile","style":"stylized","targetProfile":"mobile_medium","randomSeed":27419,"stages":[{"id":"launch","trigger":"on_launch","duration":0.16,"enabled":true,"modules":[{"id":"launch_flash","kind":"impact_flash","templateId":"PFT_2D_LaunchFlash","enabled":true,"parameters":{"lifetime":0.16,"size":1.35}},{"id":"energy_body","kind":"energy_body","templateId":"PFT_2D_FireCore","enabled":true,"parameters":{"scale":2.25}}]},{"id":"travel","trigger":"after_previous","duration":1,"enabled":true,"modules":[{"id":"motion_trail","kind":"motion_trail","templateId":"PFT_2D_FireTrail","enabled":true,"attachTo":"energy_body","parameters":{"time":0.4,"width":0.5}},{"id":"secondary_particles","kind":"secondary_particles","templateId":"PFT_2D_Embers","enabled":true,"attachTo":"energy_body","parameters":{"rate":16,"lifetime":0.8}}]},{"id":"impact","trigger":"on_hit","duration":0.42,"enabled":true,"modules":[{"id":"impact_burst","kind":"impact_burst","templateId":"PFT_2D_FireImpact","enabled":true,"parameters":{"count":36,"speed":5.4}},{"id":"shockwave","kind":"shockwave","templateId":"PFT_2D_Shockwave","enabled":true,"parameters":{"lifetime":0.42,"endSize":3.6}}]}],"metadata":{"createdBy":"s9_ai_workflow_developer","templateCatalogVersion":"1"}}
