{"recipeVersion":1,"revision":1,"id":"cap_residue_trail_3d","name":"Capability Support - Neutral Residue","dimension":"3d","archetype":"trail","style":{"token":"stylized","palette":{"primary":"#8FA3B8","secondary":"#DDE6F0","accent":"#FFFFFF"}},"targetProfile":"mobile_medium","randomSeed":98,"stages":[{"id":"residue","trigger":"on_launch","duration":0.6,"enabled":true,"modules":[{"id":"core","kind":"energy_body","templateId":"PFT_3D_FireCore","parameters":{"scale":0.6},"enabled":true}]}],"metadata":{"createdBy":"capability-support","templateCatalogVersion":"1.0.0"}}
