{
  "recipeVersion": 1,
  "revision": 1,
  "id": "button_press_fx_ui",
  "name": "Button Press Fx Ui",
  "dimension": "2d",
  "archetype": "screen_ui",
  "style": {
    "token": "stylized",
    "palette": {
      "primary": "#57DDF2",
      "secondary": "#BFF8FF",
      "accent": "#FFFFFF"
    },
    "outline": 0.12,
    "shading_steps": 4,
    "noise_scale": 1.2,
    "glow_strength": 1.1
  },
  "behavior": {
    "hit": {
      "type": "single"
    },
    "emission": {
      "type": "single"
    },
    "timing": {
      "type": "instant"
    }
  },
  "content": {
    "family": "game_ui",
    "parameters": {
      "palette": "cyan",
      "scale_with_button": true
    }
  },
  "targetProfile": "mobile_medium",
  "randomSeed": 3363918823,
  "stages": [
    {
      "id": "main",
      "trigger": "manual",
      "duration": 0.28,
      "enabled": true,
      "modules": [
        {
          "id": "body",
          "kind": "energy_body",
          "templateId": "PFT_2D_FireCore",
          "parameters": {
            "scale": 1.0
          },
          "enabled": true
        },
        {
          "id": "flow",
          "kind": "motion_trail",
          "templateId": "PFT_2D_FireTrail",
          "parameters": {
            "time": 0.3,
            "width": 0.25
          },
          "enabled": true,
          "attachTo": "body"
        },
        {
          "id": "secondary",
          "kind": "secondary_particles",
          "templateId": "PFT_2D_Embers",
          "parameters": {
            "rate": 10,
            "lifetime": 0.55
          },
          "enabled": true,
          "attachTo": "body"
        },
        {
          "id": "accent",
          "kind": "shockwave",
          "templateId": "PFT_2D_Shockwave",
          "parameters": {
            "lifetime": 0.3,
            "endSize": 2.1
          },
          "enabled": true
        }
      ]
    }
  ],
  "metadata": {
    "createdBy": "w11-w17-independent-content",
    "templateCatalogVersion": "1.0.0"
  }
}