{"recipeVersion":1,"revision":1,"id":"impact_echo","name":"Impact Echo","dimension":"2d","archetype":"projectile","style":"stylized","targetProfile":"pc_editor","randomSeed":28491735,"stages":[{"id":"launch","trigger":"on_launch","duration":0.12,"modules":[{"id":"launchFlash","kind":"impact_flash","templateId":"launchFlash","parameters":{"lifetime":0.1,"size":0.7},"enabled":true},{"id":"launchCore","kind":"energy_body","templateId":"fireCore","parameters":{"scale":0.9},"enabled":true}],"enabled":true},{"id":"travel","trigger":"after_previous","duration":0.3,"modules":[{"id":"travelCore","kind":"energy_body","templateId":"fireCore","parameters":{"scale":0.65},"enabled":true}],"enabled":true},{"id":"impact","trigger":"on_hit","duration":0.5,"modules":[{"id":"impactFlash","kind":"impact_flash","templateId":"launchFlash","parameters":{"lifetime":0.22,"size":1.8},"enabled":true},{"id":"impactBurst","kind":"impact_burst","templateId":"fireImpact","parameters":{"count":40,"speed":6},"enabled":true,"attachTo":"impactFlash"},{"id":"impactShockwave","kind":"shockwave","templateId":"shockwave","parameters":{"lifetime":0.5,"endSize":4},"enabled":true,"attachTo":"impactFlash"}],"enabled":true}],"metadata":{"createdBy":"S9","templateCatalogVersion":"v1"}}
