{
  "recipeVersion": 1,
  "revision": 1,
  "id": "mechanical_hunter_kit_showcase_3d",
  "name": "Mechanical Hunter Kit Showcase 3d",
  "dimension": "3d",
  "archetype": "composite",
  "style": {
    "token": "stylized",
    "palette": {
      "primary": "#8C642E",
      "secondary": "#D9B96E",
      "accent": "#7FEAFF"
    },
    "outline": 0.1,
    "shading_steps": 4,
    "noise_scale": 1.2,
    "glow_strength": 1.05
  },
  "targetProfile": "mobile_medium",
  "randomSeed": 1814847156,
  "stages": [
    {
      "id": "main",
      "trigger": "manual",
      "duration": 6.6,
      "enabled": true,
      "modules": [
        {
          "id": "body",
          "kind": "energy_body",
          "templateId": "PFT_3D_FireCore",
          "parameters": {
            "scale": 1.0
          },
          "enabled": true
        }
      ]
    }
  ],
  "metadata": {
    "createdBy": "w13-w18-composite",
    "templateCatalogVersion": "1.0.0"
  },
  "timeline": [
    {
      "t": 0.0,
      "ref_id": "glitch_blink_transform_3d",
      "action": "play",
      "overrides": {
        "scale": 1.0,
        "palette": "hunter_steam_holo"
      }
    },
    {
      "t": 0.7,
      "ref_id": "overheat_vent_idle_aura_3d",
      "action": "play",
      "overrides": {
        "scale": 1.0,
        "palette": "hunter_steam_holo"
      }
    },
    {
      "t": 1.2,
      "ref_id": "muzzle_flash_impact_3d",
      "action": "play",
      "overrides": {
        "scale": 1.0,
        "palette": "hunter_steam_holo"
      }
    },
    {
      "t": 1.45,
      "ref_id": "muzzle_flash_impact_3d",
      "action": "play",
      "overrides": {
        "scale": 1.0,
        "palette": "hunter_steam_holo"
      }
    },
    {
      "t": 1.7,
      "ref_id": "muzzle_flash_impact_3d",
      "action": "play",
      "overrides": {
        "scale": 1.0,
        "palette": "hunter_steam_holo"
      }
    },
    {
      "t": 2.3,
      "ref_id": "steam_vent_burst_impact_3d",
      "action": "play",
      "overrides": {
        "scale": 1.0,
        "palette": "hunter_steam_holo"
      }
    },
    {
      "t": 3.0,
      "ref_id": "holo_scan_area_3d",
      "action": "play",
      "overrides": {
        "scale": 1.0,
        "palette": "hunter_steam_holo"
      }
    },
    {
      "t": 4.0,
      "ref_id": "chain_grapple_beam_3d",
      "action": "play",
      "overrides": {
        "scale": 1.0,
        "palette": "hunter_steam_holo"
      }
    },
    {
      "t": 5.2,
      "ref_id": "emp_nova_impact_2d",
      "action": "play",
      "overrides": {
        "scale": 1.0,
        "palette": "hunter_steam_holo"
      }
    }
  ],
  "camera_hints": [],
  "gates": []
}