{"recipeVersion":1,"revision":1,"id":"cap_hitscan_beam_3d","name":"Capability Blank - Hitscan Beam","dimension":"3d","archetype":"beam","style":{"token":"stylized","palette":{"primary":"#8FA3B8","secondary":"#DDE6F0","accent":"#FFFFFF"}},"targetProfile":"mobile_medium","randomSeed":201,"behavior":{"hit":{"type":"single"},"emission":{"type":"single"},"timing":{"type":"hitscan","max_range":20,"linger":0.15}},"stages":[{"id":"beam","trigger":"on_launch","duration":0.15,"enabled":true,"modules":[{"id":"source","kind":"energy_body","templateId":"PFT_3D_FireCore","parameters":{"scale":0.6},"enabled":true}]}],"metadata":{"createdBy":"capability-blank","templateCatalogVersion":"1.0.0"}}
