{"recipeVersion":1,"revision":1,"id":"slow_orb","name":"slow_orb","dimension":"2d","archetype":"projectile","style":"stylized","targetProfile":"mobile_medium","randomSeed":2849173621,"stages":[{"id":"launch","trigger":"on_launch","duration":0.2,"modules":[{"id":"launch_flash","kind":"impact_flash","templateId":"PFT_2D_LaunchFlash","parameters":{"lifetime":0.2,"size":1.8},"enabled":true},{"id":"orb_core","kind":"energy_body","templateId":"PFT_2D_FireCore","parameters":{"scale":2.4},"enabled":true}],"enabled":true},{"id":"slow_flight","trigger":"after_previous","duration":4.8,"modules":[{"id":"broad_trail","kind":"motion_trail","templateId":"PFT_2D_FireTrail","parameters":{"time":0.4,"width":0.55},"attachTo":"orb_core","enabled":true},{"id":"persistent_embers","kind":"secondary_particles","templateId":"PFT_2D_Embers","parameters":{"rate":36,"lifetime":1.1},"attachTo":"orb_core","enabled":true}],"enabled":true},{"id":"impact","trigger":"on_hit","duration":0.5,"modules":[{"id":"fast_burst","kind":"impact_burst","templateId":"PFT_2D_FireImpact","parameters":{"count":40,"speed":6},"enabled":true},{"id":"lingering_shockwave","kind":"shockwave","templateId":"PFT_2D_Shockwave","parameters":{"lifetime":0.5,"endSize":4},"enabled":true}],"enabled":true}],"metadata":{"createdBy":"S9","templateCatalogVersion":"v1"}}
