{
  "recipeVersion": 1,
  "revision": 1,
  "id": "crate_break_destruction_3d",
  "name": "Crate Break",
  "dimension": "3d",
  "archetype": "destruction",
  "style": {
    "token": "cartoon",
    "palette": {
      "primary": "#6E351C",
      "secondary": "#C77A35",
      "accent": "#FFE0A0"
    },
    "glow_strength": 1.2
  },
  "archetypeParameters": {
    "piece_count": 10,
    "explode_force": 2.6,
    "debris_lifetime": 1.25
  },
  "targetProfile": "mobile_medium",
  "randomSeed": 1767295374,
  "stages": [
    {
      "id": "active",
      "trigger": "manual",
      "duration": 1.25,
      "enabled": true,
      "modules": [
        {
          "id": "core",
          "kind": "energy_body",
          "templateId": "PFT_3D_FireCore",
          "parameters": {
            "scale": 1.0
          },
          "enabled": true
        },
        {
          "id": "debris",
          "kind": "impact_burst",
          "templateId": "PFT_3D_FireImpact",
          "parameters": {
            "count": 12,
            "speed": 3.0
          },
          "attachTo": "core",
          "enabled": true
        }
      ]
    }
  ],
  "metadata": {
    "createdBy": "w15-authoring",
    "templateCatalogVersion": "formal-1"
  }
}
