{
  "recipeVersion": 1,
  "revision": 1,
  "id": "crystal_shield_3d",
  "name": "Crystal Shield 3d",
  "dimension": "3d",
  "archetype": "shield",
  "style": {
    "token": "stylized",
    "palette": {
      "primary": "#7FD8FF",
      "secondary": "#FFFFFF",
      "accent": "#2E6BD6"
    },
    "outline": 0.12,
    "shading_steps": 4,
    "noise_scale": 1.1,
    "glow_strength": 1.25
  },
  "behavior": {
    "hit": {
      "type": "single"
    },
    "emission": {
      "type": "single"
    },
    "timing": {
      "type": "instant"
    }
  },
  "content": {
    "family": "frost",
    "parameters": {
      "petal_count": 6,
      "orbit_radius": 1.1,
      "hit_flash_color": "#FFFFFF"
    }
  },
  "targetProfile": "mobile_medium",
  "randomSeed": 3974482775,
  "stages": [
    {
      "id": "main",
      "trigger": "manual",
      "duration": 1.0,
      "enabled": true,
      "modules": [
        {
          "id": "body",
          "kind": "energy_body",
          "templateId": "PFT_3D_FireCore",
          "parameters": {
            "scale": 1.0
          },
          "enabled": true
        },
        {
          "id": "flow",
          "kind": "motion_trail",
          "templateId": "PFT_3D_FireTrail",
          "parameters": {
            "time": 0.28,
            "width": 0.25
          },
          "attachTo": "body",
          "enabled": true
        },
        {
          "id": "secondary",
          "kind": "secondary_particles",
          "templateId": "PFT_3D_Embers",
          "parameters": {
            "rate": 12,
            "lifetime": 0.55
          },
          "attachTo": "body",
          "enabled": true
        },
        {
          "id": "accent",
          "kind": "shockwave",
          "templateId": "PFT_3D_Shockwave",
          "parameters": {
            "lifetime": 0.3,
            "endSize": 2.4
          },
          "enabled": true
        }
      ]
    }
  ],
  "metadata": {
    "createdBy": "w3-w8-element-family",
    "templateCatalogVersion": "1.0.0"
  }
}