{
  "recipeVersion": 1,
  "revision": 1,
  "id": "frost_creep_ui",
  "name": "Frost Creep Ui",
  "dimension": "2d",
  "archetype": "screen_ui",
  "style": {
    "token": "stylized",
    "palette": {
      "primary": "#7FD8FF",
      "secondary": "#E8FCFF",
      "accent": "#FFFFFF"
    },
    "outline": 0.12,
    "shading_steps": 4,
    "noise_scale": 1.2,
    "glow_strength": 1.1
  },
  "behavior": {
    "hit": {
      "type": "single"
    },
    "emission": {
      "type": "single"
    },
    "timing": {
      "type": "sustained"
    }
  },
  "content": {
    "family": "screen_ui",
    "parameters": {
      "intensity": 0.62,
      "palette": "frost",
      "stack_level": 1
    }
  },
  "targetProfile": "mobile_medium",
  "randomSeed": 3581297094,
  "stages": [
    {
      "id": "main",
      "trigger": "manual",
      "duration": 1.5,
      "enabled": true,
      "modules": [
        {
          "id": "body",
          "kind": "energy_body",
          "templateId": "PFT_2D_FireCore",
          "parameters": {
            "scale": 1.0
          },
          "enabled": true
        },
        {
          "id": "flow",
          "kind": "motion_trail",
          "templateId": "PFT_2D_FireTrail",
          "parameters": {
            "time": 0.3,
            "width": 0.25
          },
          "enabled": true,
          "attachTo": "body"
        },
        {
          "id": "secondary",
          "kind": "secondary_particles",
          "templateId": "PFT_2D_Embers",
          "parameters": {
            "rate": 10,
            "lifetime": 0.55
          },
          "enabled": true,
          "attachTo": "body"
        },
        {
          "id": "accent",
          "kind": "shockwave",
          "templateId": "PFT_2D_Shockwave",
          "parameters": {
            "lifetime": 0.3,
            "endSize": 2.1
          },
          "enabled": true
        }
      ]
    }
  ],
  "metadata": {
    "createdBy": "w11-w17-independent-content",
    "templateCatalogVersion": "1.0.0"
  }
}