{"recipeVersion":1,"revision":1,"id":"cap_sweep_beam_3d","name":"Capability Blank - Sweep Beam","dimension":"3d","archetype":"beam","style":{"token":"stylized","palette":{"primary":"#8FA3B8","secondary":"#DDE6F0","accent":"#FFFFFF"}},"targetProfile":"mobile_medium","randomSeed":203,"behavior":{"motion":{"type":"sweep","sweep_speed_max":90,"inertia":0.12},"hit":{"type":"single"},"emission":{"type":"single"},"timing":{"type":"sustained"}},"stages":[{"id":"beam","trigger":"on_launch","duration":2,"enabled":true,"modules":[{"id":"source","kind":"energy_body","templateId":"PFT_3D_FireCore","parameters":{"scale":0.6},"enabled":true}]}],"metadata":{"createdBy":"capability-blank","templateCatalogVersion":"1.0.0"}}
